Difficulty,Title,Frequency,Acceptance Rate,Link,Topics
HARD,Maximum Area Rectangle With Point Constraints II,100.0,0.0024322736950297334,https://leetcode.com/problems/maximum-area-rectangle-with-point-constraints-ii,"Array, Math, Binary Indexed Tree, Segment Tree, Geometry, Sorting"
MEDIUM,Maximum Area Rectangle With Point Constraints I,100.0,0.005190626979100697,https://leetcode.com/problems/maximum-area-rectangle-with-point-constraints-i,"Array, Math, Binary Indexed Tree, Segment Tree, Geometry, Sorting, Enumeration"
HARD,Special Binary String,97.6,0.007937528892289545,https://leetcode.com/problems/special-binary-string,"String, Divide and Conquer, Sorting"
MEDIUM,Minimum Length of Anagram Concatenation,78.8,0.003988334322936676,https://leetcode.com/problems/minimum-length-of-anagram-concatenation,"Hash Table, String, Counting"
EASY,Two Sum,78.8,0.005768896943827939,https://leetcode.com/problems/two-sum,"Array, Hash Table"
MEDIUM,Count the Number of Good Subsequences,78.8,0.004847957288765088,https://leetcode.com/problems/count-the-number-of-good-subsequences,"Hash Table, Math, String, Combinatorics, Counting"
MEDIUM,Maximize Greatness of an Array,78.8,0.006182975632681545,https://leetcode.com/problems/maximize-greatness-of-an-array,"Array, Two Pointers, Greedy, Sorting"
EASY,Valid Word,72.2,0.005087996553710328,https://leetcode.com/problems/valid-word,String
MEDIUM,Make a Positive Array,62.9,0.003634351482957061,https://leetcode.com/problems/make-a-positive-array,"Array, Greedy, Prefix Sum"
EASY,Valid Palindrome,62.9,0.005358828705148624,https://leetcode.com/problems/valid-palindrome,"Two Pointers, String"
