Difficulty,Title,Frequency,Acceptance Rate,Link,Topics
EASY,Classifying Triangles by Lengths,100.0,0.005130391173520562,https://leetcode.com/problems/classifying-triangles-by-lengths,Database
HARD,Minimize OR of Remaining Elements Using Operations,100.0,0.0030624744793793387,https://leetcode.com/problems/minimize-or-of-remaining-elements-using-operations,"Array, Greedy, Bit Manipulation"
MEDIUM,Construct the Minimum Bitwise Array II,100.0,0.0066624693993646575,https://leetcode.com/problems/construct-the-minimum-bitwise-array-ii,"Array, Bit Manipulation"
EASY,Construct the Minimum Bitwise Array I,100.0,0.00852489544219556,https://leetcode.com/problems/construct-the-minimum-bitwise-array-i,"Array, Bit Manipulation"
MEDIUM,Number of Islands,65.6,0.006459367287189016,https://leetcode.com/problems/number-of-islands,"Array, Depth-First Search, Breadth-First Search, Union-Find, Matrix"
