Difficulty,Title,Frequency,Acceptance Rate,Link,Topics
HARD,Difference Between Maximum and Minimum Price Sum,100.0,0.003373039273499233,https://leetcode.com/problems/difference-between-maximum-and-minimum-price-sum,"Array, Dynamic Programming, Tree, Depth-First Search"
HARD,Find Longest Awesome Substring,100.0,0.004707701893762378,https://leetcode.com/problems/find-longest-awesome-substring,"Hash Table, String, Bit Manipulation"
MEDIUM,Min Cost to Connect All Points,100.0,0.007114607215018194,https://leetcode.com/problems/min-cost-to-connect-all-points,"Array, Union-Find, Graph Theory, Minimum Spanning Tree"
HARD,Maximum XOR of Two Non-Overlapping Subtrees,100.0,0.005224037954665261,https://leetcode.com/problems/maximum-xor-of-two-non-overlapping-subtrees,"Tree, Depth-First Search, Graph Theory, Trie"
MEDIUM,Minimum Cost to Buy Apples,100.0,0.006729394734461231,https://leetcode.com/problems/minimum-cost-to-buy-apples,"Array, Graph Theory, Heap (Priority Queue), Shortest Path"
MEDIUM,Largest Submatrix With Rearrangements,100.0,0.008018231843744332,https://leetcode.com/problems/largest-submatrix-with-rearrangements,"Array, Greedy, Sorting, Matrix"
MEDIUM,Find the Winner of an Array Game,100.0,0.0056861634518898425,https://leetcode.com/problems/find-the-winner-of-an-array-game,"Array, Simulation"
MEDIUM,Number of Sub-arrays With Odd Sum,100.0,0.0055683807166254096,https://leetcode.com/problems/number-of-sub-arrays-with-odd-sum,"Array, Math, Dynamic Programming, Prefix Sum"
