Difficulty,Title,Frequency,Acceptance Rate,Link,Topics
MEDIUM,LRU Cache,100.0,0.004754603276446281,https://leetcode.com/problems/lru-cache,"Hash Table, Linked List, Design, Doubly-Linked List"
MEDIUM,Delete Node in a BST,88.2,0.005488259568659837,https://leetcode.com/problems/delete-node-in-a-bst,"Tree, Binary Search Tree, Binary Tree"
MEDIUM,Number of Islands,88.2,0.006459364985129085,https://leetcode.com/problems/number-of-islands,"Array, Depth-First Search, Breadth-First Search, Union-Find, Matrix"
MEDIUM,Single Element in a Sorted Array,88.2,0.005930893530351025,https://leetcode.com/problems/single-element-in-a-sorted-array,"Array, Binary Search"
MEDIUM,Longest Increasing Subsequence,88.2,0.005957434290351335,https://leetcode.com/problems/longest-increasing-subsequence,"Array, Binary Search, Dynamic Programming"
