Difficulty,Title,Frequency,Acceptance Rate,Link,Topics
EASY,Two Sum,100.0,0.005768896407290114,https://leetcode.com/problems/two-sum,"Array, Hash Table"
MEDIUM,Maximum Subarray,95.8,0.005347379246651074,https://leetcode.com/problems/maximum-subarray,"Array, Divide and Conquer, Dynamic Programming"
EASY,Toeplitz Matrix,90.8,0.006972944965100481,https://leetcode.com/problems/toeplitz-matrix,"Array, Matrix"
EASY,First Unique Character in a String,84.7,0.0065712277656194895,https://leetcode.com/problems/first-unique-character-in-a-string,"Hash Table, String, Queue, Counting"
EASY,Move Zeroes,76.9,0.0063988762774617155,https://leetcode.com/problems/move-zeroes,"Array, Two Pointers"
MEDIUM,Maximum Product Subarray,76.9,0.0036570604646891324,https://leetcode.com/problems/maximum-product-subarray,"Array, Dynamic Programming"
MEDIUM,Spiral Matrix,76.9,0.005707393081106957,https://leetcode.com/problems/spiral-matrix,"Array, Matrix, Simulation"
MEDIUM,Maximum Total Subarray Value I,76.9,0.0071913101307914,https://leetcode.com/problems/maximum-total-subarray-value-i,"Array, Greedy"
EASY,Palindrome Number,76.9,0.006069119180402026,https://leetcode.com/problems/palindrome-number,Math
MEDIUM,Container With Most Water,76.9,0.0060242818585502355,https://leetcode.com/problems/container-with-most-water,"Array, Two Pointers, Greedy"
MEDIUM,Rotate Array,76.9,0.004510333025974378,https://leetcode.com/problems/rotate-array,"Array, Math, Two Pointers"
EASY,Longest Common Prefix,65.9,0.004778176509286588,https://leetcode.com/problems/longest-common-prefix,"Array, String, Trie"
EASY,Valid Anagram,65.9,0.006826515034245609,https://leetcode.com/problems/valid-anagram,"Hash Table, String, Sorting"
MEDIUM,Find Minimum in Rotated Sorted Array,65.9,0.005486479410516236,https://leetcode.com/problems/find-minimum-in-rotated-sorted-array,"Array, Binary Search"
EASY,Remove Duplicates from Sorted Array,65.9,0.0063080602081013225,https://leetcode.com/problems/remove-duplicates-from-sorted-array,"Array, Two Pointers"
EASY,Find Numbers with Even Number of Digits,65.9,0.007983315270957286,https://leetcode.com/problems/find-numbers-with-even-number-of-digits,"Array, Math"
EASY,Reverse String,65.9,0.008093605003858823,https://leetcode.com/problems/reverse-string,"Two Pointers, String"
EASY,Minimum Depth of Binary Tree,65.9,0.0053166198890628605,https://leetcode.com/problems/minimum-depth-of-binary-tree,"Tree, Depth-First Search, Breadth-First Search, Binary Tree"
MEDIUM,House Robber,65.9,0.005332529940642317,https://leetcode.com/problems/house-robber,"Array, Dynamic Programming"
EASY,Palindrome Linked List,65.9,0.005821430420237833,https://leetcode.com/problems/palindrome-linked-list,"Linked List, Two Pointers, Stack, Recursion"
EASY,Maximum Depth of Binary Tree,65.9,0.007830403067389843,https://leetcode.com/problems/maximum-depth-of-binary-tree,"Tree, Depth-First Search, Breadth-First Search, Binary Tree"
EASY,Contains Duplicate II,65.9,0.005145324892991739,https://leetcode.com/problems/contains-duplicate-ii,"Array, Hash Table, Sliding Window"
MEDIUM,Maximum Ice Cream Bars,65.9,0.0077210015685818855,https://leetcode.com/problems/maximum-ice-cream-bars,"Array, Greedy, Sorting, Counting Sort"
HARD,Median of Two Sorted Arrays,65.9,0.004684229014732372,https://leetcode.com/problems/median-of-two-sorted-arrays,"Array, Binary Search, Divide and Conquer"
MEDIUM,Find First and Last Position of Element in Sorted Array,65.9,0.004912169426549642,https://leetcode.com/problems/find-first-and-last-position-of-element-in-sorted-array,"Array, Binary Search"
MEDIUM,Single Element in a Sorted Array,65.9,0.005930909048128845,https://leetcode.com/problems/single-element-in-a-sorted-array,"Array, Binary Search"
MEDIUM,Longest Palindromic Substring,65.9,0.003804654987635423,https://leetcode.com/problems/longest-palindromic-substring,"Two Pointers, String, Dynamic Programming"
MEDIUM,Product of Array Except Self,65.9,0.006900170292913281,https://leetcode.com/problems/product-of-array-except-self,"Array, Prefix Sum"
