Difficulty,Title,Frequency,Acceptance Rate,Link,Topics
MEDIUM,Keys and Rooms,100.0,0.0075891916844246675,https://leetcode.com/problems/keys-and-rooms,"Depth-First Search, Breadth-First Search, Graph Theory"
MEDIUM,Course Schedule,100.0,0.005164936129682347,https://leetcode.com/problems/course-schedule,"Depth-First Search, Breadth-First Search, Graph Theory, Topological Sort"
HARD,Binary Tree Cameras,100.0,0.004795294259026055,https://leetcode.com/problems/binary-tree-cameras,"Dynamic Programming, Tree, Depth-First Search, Binary Tree"
MEDIUM,Largest Number,100.0,0.004323274932414328,https://leetcode.com/problems/largest-number,"Array, String, Greedy, Sorting"
MEDIUM,Decode Ways,100.0,0.003813474898384303,https://leetcode.com/problems/decode-ways,"String, Dynamic Programming"
HARD,Collect Coins in a Tree,100.0,0.004038745140099209,https://leetcode.com/problems/collect-coins-in-a-tree,"Array, Tree, Graph Theory, Topological Sort"
MEDIUM,01 Matrix,100.0,0.005420838380544167,https://leetcode.com/problems/01-matrix,"Array, Dynamic Programming, Breadth-First Search, Matrix"
