Difficulty,Title,Frequency,Acceptance Rate,Link,Topics
MEDIUM,Find the Celebrity,100.0,0.004902712789119515,https://leetcode.com/problems/find-the-celebrity,"Two Pointers, Graph Theory, Interactive"
EASY,Best Time to Buy and Sell Stock,85.3,0.005696336597165568,https://leetcode.com/problems/best-time-to-buy-and-sell-stock,"Array, Dynamic Programming"
MEDIUM,Best Time to Buy and Sell Stock II,85.3,0.007124018311930058,https://leetcode.com/problems/best-time-to-buy-and-sell-stock-ii,"Array, Dynamic Programming, Greedy"
EASY,Valid Parentheses,70.6,0.004436557611945568,https://leetcode.com/problems/valid-parentheses,"String, Stack"
EASY,Two Sum,70.6,0.005768895608331339,https://leetcode.com/problems/two-sum,"Array, Hash Table"
