Difficulty,Title,Frequency,Acceptance Rate,Link,Topics
HARD,Text Justification,100.0,0.005138915871826422,https://leetcode.com/problems/text-justification,"Array, String, Simulation"
HARD,Length of Longest V-Shaped Diagonal Segment,98.9,0.005617814133151556,https://leetcode.com/problems/length-of-longest-v-shaped-diagonal-segment,"Array, Dynamic Programming, Memoization, Matrix"
MEDIUM,Rotating the Box,96.7,0.008248614502666429,https://leetcode.com/problems/rotating-the-box,"Array, Two Pointers, Matrix"
EASY,Two Sum,95.5,0.005768896943827939,https://leetcode.com/problems/two-sum,"Array, Hash Table"
EASY,Split the Array,94.2,0.006148761869298083,https://leetcode.com/problems/split-the-array,"Array, Hash Table, Counting"
MEDIUM,Longest Substring Without Repeating Characters,92.9,0.003929965776265169,https://leetcode.com/problems/longest-substring-without-repeating-characters,"Hash Table, String, Sliding Window"
MEDIUM,3Sum,92.9,0.003930121308153282,https://leetcode.com/problems/3sum,"Array, Two Pointers, Sorting"
MEDIUM,Minimum Operations to Write the Letter Y on a Grid,92.9,0.006463220538371047,https://leetcode.com/problems/minimum-operations-to-write-the-letter-y-on-a-grid,"Array, Hash Table, Matrix, Counting"
MEDIUM,Find the Length of the Longest Common Prefix,90.0,0.006227348089105884,https://leetcode.com/problems/find-the-length-of-the-longest-common-prefix,"Array, Hash Table, String, Trie"
EASY,Best Time to Buy and Sell Stock,86.6,0.005696338702405084,https://leetcode.com/problems/best-time-to-buy-and-sell-stock,"Array, Dynamic Programming"
MEDIUM,LRU Cache,86.6,0.0047546407921135415,https://leetcode.com/problems/lru-cache,"Hash Table, Linked List, Design, Doubly-Linked List"
EASY,Create Target Array in the Given Order,82.8,0.008650457565669772,https://leetcode.com/problems/create-target-array-in-the-given-order,"Array, Simulation"
HARD,Block Placement Queries,82.8,0.004145970507973862,https://leetcode.com/problems/block-placement-queries,"Array, Binary Search, Binary Indexed Tree, Segment Tree, Ordered Set"
MEDIUM,Number of Black Blocks,80.7,0.004195066171784202,https://leetcode.com/problems/number-of-black-blocks,"Array, Hash Table, Enumeration"
MEDIUM,Group Anagrams,78.3,0.007279897151569383,https://leetcode.com/problems/group-anagrams,"Array, Hash Table, String, Sorting"
EASY,Divisor Game,78.3,0.007197501865310747,https://leetcode.com/problems/divisor-game,"Math, Dynamic Programming, Brainteaser, Game Theory"
MEDIUM,Count Nodes With the Highest Score,78.3,0.005282230137528445,https://leetcode.com/problems/count-nodes-with-the-highest-score,"Array, Tree, Depth-First Search, Binary Tree"
EASY,Two Furthest Houses With Different Colors,78.3,0.007176771685429659,https://leetcode.com/problems/two-furthest-houses-with-different-colors,"Array, Greedy"
HARD,Earliest Possible Day of Full Bloom,78.3,0.0071190216204411435,https://leetcode.com/problems/earliest-possible-day-of-full-bloom,"Array, Greedy, Sorting"
MEDIUM,Match Alphanumerical Pattern in Matrix I,78.3,0.006523809523809524,https://leetcode.com/problems/match-alphanumerical-pattern-in-matrix-i,"Array, Hash Table, String, Matrix"
MEDIUM,Maximum Number of Events That Can Be Attended,78.3,0.003900883144257029,https://leetcode.com/problems/maximum-number-of-events-that-can-be-attended,"Array, Greedy, Sorting, Heap (Priority Queue)"
EASY,Odd String Difference,78.3,0.00620833390277569,https://leetcode.com/problems/odd-string-difference,"Array, Hash Table, String"
MEDIUM,Simplify Path,78.3,0.005080347881652438,https://leetcode.com/problems/simplify-path,"String, Stack"
MEDIUM,Number of Adjacent Elements With the Same Color,78.3,0.0059854778906893715,https://leetcode.com/problems/number-of-adjacent-elements-with-the-same-color,Array
MEDIUM,Merge Intervals,75.7,0.005211662279649603,https://leetcode.com/problems/merge-intervals,"Array, Sorting"
HARD,Trapping Rain Water,72.8,0.006761528111952068,https://leetcode.com/problems/trapping-rain-water,"Array, Two Pointers, Dynamic Programming, Stack, Monotonic Stack"
MEDIUM,Maximum Subarray,72.8,0.005347378708175318,https://leetcode.com/problems/maximum-subarray,"Array, Divide and Conquer, Dynamic Programming"
HARD,Largest Rectangle in Histogram,72.8,0.005018794551238438,https://leetcode.com/problems/largest-rectangle-in-histogram,"Array, Stack, Monotonic Stack"
MEDIUM,Number of Divisible Triplet Sums,72.8,0.006759746391474437,https://leetcode.com/problems/number-of-divisible-triplet-sums,"Array, Hash Table"
HARD,Maximum Sum of Alternating Subsequence With Distance at Least K,72.8,0.0032072308477294263,https://leetcode.com/problems/maximum-sum-of-alternating-subsequence-with-distance-at-least-k,"Array, Dynamic Programming, Segment Tree"
MEDIUM,Longest Palindromic Substring,69.5,0.003804655500546776,https://leetcode.com/problems/longest-palindromic-substring,"Two Pointers, String, Dynamic Programming"
EASY,Valid Parentheses,69.5,0.004436559274735546,https://leetcode.com/problems/valid-parentheses,"String, Stack"
MEDIUM,Number of Islands,69.5,0.006459363956527961,https://leetcode.com/problems/number-of-islands,"Array, Depth-First Search, Breadth-First Search, Union-Find, Matrix"
EASY,Longest Common Prefix,65.7,0.00477817428553112,https://leetcode.com/problems/longest-common-prefix,"Array, String, Trie"
MEDIUM,Minimum Time Difference,65.7,0.006262648564433562,https://leetcode.com/problems/minimum-time-difference,"Array, Math, String, Sorting"
MEDIUM,Minimum Absolute Difference Between Elements With Constraint,65.7,0.0037825994582248897,https://leetcode.com/problems/minimum-absolute-difference-between-elements-with-constraint,"Array, Binary Search, Ordered Set"
MEDIUM,Beautiful Arrangement,65.7,0.006483887887038412,https://leetcode.com/problems/beautiful-arrangement,"Array, Dynamic Programming, Backtracking, Bit Manipulation, Bitmask"
MEDIUM,Walls and Gates,61.2,0.006404519398323927,https://leetcode.com/problems/walls-and-gates,"Array, Breadth-First Search, Matrix"
MEDIUM,Spiral Matrix,61.2,0.005707388750901669,https://leetcode.com/problems/spiral-matrix,"Array, Matrix, Simulation"
EASY,Reverse Linked List,61.2,0.008070849744069002,https://leetcode.com/problems/reverse-linked-list,"Linked List, Recursion"
MEDIUM,Rotate Image,61.2,0.008027345814582037,https://leetcode.com/problems/rotate-image,"Array, Math, Matrix"
HARD,Count Palindromic Subsequences,61.2,0.004130848371783742,https://leetcode.com/problems/count-palindromic-subsequences,"String, Dynamic Programming"
MEDIUM,Exclusive Time of Functions,61.2,0.00662148498641671,https://leetcode.com/problems/exclusive-time-of-functions,"Array, Stack"
MEDIUM,Course Schedule,55.7,0.005164944232628777,https://leetcode.com/problems/course-schedule,"Depth-First Search, Breadth-First Search, Graph Theory, Topological Sort"
MEDIUM,Longest Continuous Subarray With Absolute Diff Less Than or Equal to Limit,55.7,0.0057795319128310174,https://leetcode.com/problems/longest-continuous-subarray-with-absolute-diff-less-than-or-equal-to-limit,"Array, Queue, Sliding Window, Heap (Priority Queue), Ordered Set, Monotonic Queue"
MEDIUM,Restore IP Addresses,55.7,0.005629963733993056,https://leetcode.com/problems/restore-ip-addresses,"String, Backtracking"
MEDIUM,Container With Most Water,55.7,0.006024277573333843,https://leetcode.com/problems/container-with-most-water,"Array, Two Pointers, Greedy"
EASY,Merge Two Sorted Lists,55.7,0.006845216588370958,https://leetcode.com/problems/merge-two-sorted-lists,"Linked List, Recursion"
MEDIUM,Sort Colors,55.7,0.006987536385439906,https://leetcode.com/problems/sort-colors,"Array, Two Pointers, Sorting"
EASY,Happy Number,55.7,0.005983063599866116,https://leetcode.com/problems/happy-number,"Hash Table, Math, Two Pointers"
MEDIUM,Grid Teleportation Traversal,55.7,0.002375048300656889,https://leetcode.com/problems/grid-teleportation-traversal,"Array, Hash Table, Breadth-First Search, Matrix"
MEDIUM,Matrix Block Sum,55.7,0.0076639596901718,https://leetcode.com/problems/matrix-block-sum,"Array, Matrix, Prefix Sum"
MEDIUM,Gas Station,55.7,0.004819455610149443,https://leetcode.com/problems/gas-station,"Array, Greedy"
MEDIUM,Subarray Sum Equals K,55.7,0.004756672478798268,https://leetcode.com/problems/subarray-sum-equals-k,"Array, Hash Table, Prefix Sum"
EASY,Number of Changing Keys,55.7,0.008078916677465336,https://leetcode.com/problems/number-of-changing-keys,String
HARD,Minimum Cost Path with Teleportations,55.7,0.004542914960447512,https://leetcode.com/problems/minimum-cost-path-with-teleportations,"Array, Dynamic Programming, Matrix"
MEDIUM,Number of Perfect Pairs,55.7,0.003430410056869201,https://leetcode.com/problems/number-of-perfect-pairs,"Array, Math, Two Pointers, Sorting"
MEDIUM,Divide Players Into Teams of Equal Skill,55.7,0.006892998173319724,https://leetcode.com/problems/divide-players-into-teams-of-equal-skill,"Array, Hash Table, Two Pointers, Sorting"
MEDIUM,Maximum OR,55.7,0.004329028757460661,https://leetcode.com/problems/maximum-or,"Array, Greedy, Bit Manipulation, Prefix Sum"
MEDIUM,Minimum Number of Swaps to Make the String Balanced,55.7,0.007803691201613256,https://leetcode.com/problems/minimum-number-of-swaps-to-make-the-string-balanced,"Two Pointers, String, Stack, Greedy"
MEDIUM,Check If Array Pairs Are Divisible by k,48.7,0.004619149566878562,https://leetcode.com/problems/check-if-array-pairs-are-divisible-by-k,"Array, Hash Table, Counting"
EASY,Diameter of Binary Tree,48.7,0.0065727526610959005,https://leetcode.com/problems/diameter-of-binary-tree,"Tree, Depth-First Search, Binary Tree"
EASY,Image Smoother,48.7,0.0069375442128747885,https://leetcode.com/problems/image-smoother,"Array, Matrix"
MEDIUM,Top K Frequent Elements,48.7,0.006670466481723438,https://leetcode.com/problems/top-k-frequent-elements,"Array, Hash Table, Divide and Conquer, Sorting, Heap (Priority Queue), Bucket Sort, Counting, Quickselect"
HARD,Word Ladder,48.7,0.0045844224829187106,https://leetcode.com/problems/word-ladder,"Hash Table, String, Breadth-First Search"
MEDIUM,Candy Crush,48.7,0.0077610878591870824,https://leetcode.com/problems/candy-crush,"Array, Two Pointers, Matrix, Simulation"
MEDIUM,Partition Equal Subset Sum,48.7,0.004963695970006009,https://leetcode.com/problems/partition-equal-subset-sum,"Array, Dynamic Programming"
MEDIUM,Number of Matching Subsequences,48.7,0.005060926415104602,https://leetcode.com/problems/number-of-matching-subsequences,"Array, Hash Table, String, Binary Search, Dynamic Programming, Trie, Sorting"
EASY,Balanced Binary Tree,48.7,0.005858699595573743,https://leetcode.com/problems/balanced-binary-tree,"Tree, Depth-First Search, Binary Tree"
HARD,Find Median from Data Stream,48.7,0.005463241598660296,https://leetcode.com/problems/find-median-from-data-stream,"Two Pointers, Design, Sorting, Heap (Priority Queue), Data Stream"
HARD,Longest Valid Parentheses,48.7,0.003902753113246049,https://leetcode.com/problems/longest-valid-parentheses,"String, Dynamic Programming, Stack"
MEDIUM,Best Time to Buy and Sell Stock II,48.7,0.007124019985176692,https://leetcode.com/problems/best-time-to-buy-and-sell-stock-ii,"Array, Dynamic Programming, Greedy"
MEDIUM,Product of Array Except Self,48.7,0.0069001713735827195,https://leetcode.com/problems/product-of-array-except-self,"Array, Prefix Sum"
EASY,Add Binary,48.7,0.005817458079557144,https://leetcode.com/problems/add-binary,"Math, String, Bit Manipulation, Simulation"
EASY,Add Strings,48.7,0.005217266637266408,https://leetcode.com/problems/add-strings,"Math, String, Simulation"
MEDIUM,Sell Diminishing-Valued Colored Balls,48.7,0.0030236561383375497,https://leetcode.com/problems/sell-diminishing-valued-colored-balls,"Array, Math, Binary Search, Greedy, Sorting, Heap (Priority Queue)"
HARD,Median of Two Sorted Arrays,39.0,0.004684251722617945,https://leetcode.com/problems/median-of-two-sorted-arrays,"Array, Binary Search, Divide and Conquer"
EASY,Plus One,39.0,0.005011665400878256,https://leetcode.com/problems/plus-one,"Array, Math"
MEDIUM,Reverse Words in a String,39.0,0.005681709171606788,https://leetcode.com/problems/reverse-words-in-a-string,"Two Pointers, String"
MEDIUM,Daily Temperatures,39.0,0.006882791335745637,https://leetcode.com/problems/daily-temperatures,"Array, Stack, Monotonic Stack"
MEDIUM,Find Score of an Array After Marking All Elements,39.0,0.00645242967475458,https://leetcode.com/problems/find-score-of-an-array-after-marking-all-elements,"Array, Hash Table, Sorting, Heap (Priority Queue), Simulation"
HARD,Reverse Nodes in k-Group,39.0,0.006642210833004798,https://leetcode.com/problems/reverse-nodes-in-k-group,"Linked List, Recursion"
MEDIUM,Rotate Array,39.0,0.004510327473502637,https://leetcode.com/problems/rotate-array,"Array, Math, Two Pointers"
EASY,Valid Anagram,39.0,0.006826516388558801,https://leetcode.com/problems/valid-anagram,"Hash Table, String, Sorting"
HARD,Best Time to Buy and Sell Stock III,39.0,0.005401008675484372,https://leetcode.com/problems/best-time-to-buy-and-sell-stock-iii,"Array, Dynamic Programming"
MEDIUM,Find Peak Element,39.0,0.0047029958482232735,https://leetcode.com/problems/find-peak-element,"Array, Binary Search"
HARD,Sliding Window Maximum,39.0,0.004889052495042554,https://leetcode.com/problems/sliding-window-maximum,"Array, Queue, Sliding Window, Heap (Priority Queue), Monotonic Queue"
EASY,Substrings of Size Three with Distinct Characters,39.0,0.0076861726696981205,https://leetcode.com/problems/substrings-of-size-three-with-distinct-characters,"Hash Table, String, Sliding Window, Counting"
MEDIUM,Number of Subarrays That Match a Pattern I,39.0,0.006874171690963732,https://leetcode.com/problems/number-of-subarrays-that-match-a-pattern-i,"Array, Rolling Hash, String Matching, Hash Function"
MEDIUM,House Robber II,39.0,0.004507805013475418,https://leetcode.com/problems/house-robber-ii,"Array, Dynamic Programming"
MEDIUM,Edit Distance,39.0,0.00608072841270349,https://leetcode.com/problems/edit-distance,"String, Dynamic Programming"
MEDIUM,Brightest Position on Street,39.0,0.006069428501860934,https://leetcode.com/problems/brightest-position-on-street,"Array, Sorting, Prefix Sum, Ordered Set"
EASY,Contains Duplicate,39.0,0.006445898491707449,https://leetcode.com/problems/contains-duplicate,"Array, Hash Table, Sorting"
MEDIUM,Sum Root to Leaf Numbers,39.0,0.007006506587630536,https://leetcode.com/problems/sum-root-to-leaf-numbers,"Tree, Depth-First Search, Binary Tree"
HARD,LFU Cache,39.0,0.004951439405422402,https://leetcode.com/problems/lfu-cache,"Hash Table, Linked List, Design, Doubly-Linked List"
MEDIUM,Longest Increasing Subsequence,39.0,0.005957471230427221,https://leetcode.com/problems/longest-increasing-subsequence,"Array, Binary Search, Dynamic Programming"
MEDIUM,Sort Characters By Frequency,39.0,0.007546743615875449,https://leetcode.com/problems/sort-characters-by-frequency,"Hash Table, String, Sorting, Heap (Priority Queue), Bucket Sort, Counting"
MEDIUM,Binary Tree Right Side View,39.0,0.007049443173985146,https://leetcode.com/problems/binary-tree-right-side-view,"Tree, Depth-First Search, Breadth-First Search, Binary Tree"
EASY,Check if Array Is Sorted and Rotated,39.0,0.005744922854689286,https://leetcode.com/problems/check-if-array-is-sorted-and-rotated,Array
MEDIUM,Kth Largest Element in an Array,39.0,0.00690392128960982,https://leetcode.com/problems/kth-largest-element-in-an-array,"Array, Divide and Conquer, Sorting, Heap (Priority Queue), Quickselect"
EASY,Reverse Vowels of a String,39.0,0.006157846863236009,https://leetcode.com/problems/reverse-vowels-of-a-string,"Two Pointers, String"
EASY,Valid Palindrome II,39.0,0.004438471291873303,https://leetcode.com/problems/valid-palindrome-ii,"Two Pointers, String, Greedy"
MEDIUM,Two Sum II - Input Array Is Sorted,39.0,0.0065296316080412295,https://leetcode.com/problems/two-sum-ii-input-array-is-sorted,"Array, Two Pointers, Binary Search"
MEDIUM,Ugly Number II,39.0,0.004965491091123207,https://leetcode.com/problems/ugly-number-ii,"Hash Table, Math, Dynamic Programming, Heap (Priority Queue)"
MEDIUM,Unique Paths,39.0,0.006695967877100446,https://leetcode.com/problems/unique-paths,"Math, Dynamic Programming, Combinatorics"
MEDIUM,Restore the Array From Adjacent Pairs,39.0,0.007507274883572935,https://leetcode.com/problems/restore-the-array-from-adjacent-pairs,"Array, Hash Table, Depth-First Search"
MEDIUM,Letter Combinations of a Phone Number,39.0,0.0066277930472025135,https://leetcode.com/problems/letter-combinations-of-a-phone-number,"Hash Table, String, Backtracking"
HARD,Reconstruct Itinerary,39.0,0.004467738532639633,https://leetcode.com/problems/reconstruct-itinerary,"Array, String, Depth-First Search, Graph Theory, Sorting, Heap (Priority Queue), Eulerian Circuit"
MEDIUM,Design Memory Allocator,39.0,0.005030448237995407,https://leetcode.com/problems/design-memory-allocator,"Array, Hash Table, Design, Simulation"
EASY,Last Stone Weight,39.0,0.006655525126071066,https://leetcode.com/problems/last-stone-weight,"Array, Heap (Priority Queue)"
MEDIUM,Count Mentions Per User,39.0,0.005079556129638328,https://leetcode.com/problems/count-mentions-per-user,"Array, Math, Sorting, Simulation"
MEDIUM,Best Time to Buy and Sell Stock using Strategy,39.0,0.005974329481884247,https://leetcode.com/problems/best-time-to-buy-and-sell-stock-using-strategy,"Array, Sliding Window, Prefix Sum"
HARD,Maximal Rectangle,39.0,0.005907186101192198,https://leetcode.com/problems/maximal-rectangle,"Array, Dynamic Programming, Stack, Matrix, Monotonic Stack"
EASY,Add Digits,39.0,0.006903064712864355,https://leetcode.com/problems/add-digits,"Math, Simulation, Number Theory"
HARD,Candy,39.0,0.004866092607547812,https://leetcode.com/problems/candy,"Array, Greedy"
EASY,Alternating Digit Sum,39.0,0.006920147673878246,https://leetcode.com/problems/alternating-digit-sum,Math
MEDIUM,Next Greater Element II,39.0,0.006860809027249758,https://leetcode.com/problems/next-greater-element-ii,"Array, Stack, Monotonic Stack"
MEDIUM,Word Search,39.0,0.0047587546118526385,https://leetcode.com/problems/word-search,"Array, String, Backtracking, Depth-First Search, Matrix"
EASY,Merge Sorted Array,39.0,0.005509633651522216,https://leetcode.com/problems/merge-sorted-array,"Array, Two Pointers, Sorting"
MEDIUM,Rotting Oranges,39.0,0.0058869093699178395,https://leetcode.com/problems/rotting-oranges,"Array, Breadth-First Search, Matrix"
MEDIUM,Subarray Sums Divisible by K,39.0,0.00563948299635429,https://leetcode.com/problems/subarray-sums-divisible-by-k,"Array, Hash Table, Prefix Sum"
MEDIUM,Longest Consecutive Sequence,39.0,0.0047148613325957815,https://leetcode.com/problems/longest-consecutive-sequence,"Array, Hash Table, Union-Find"
EASY,Valid Palindrome,39.0,0.005358828705148624,https://leetcode.com/problems/valid-palindrome,"Two Pointers, String"
EASY,First Unique Character in a String,39.0,0.00657121571789095,https://leetcode.com/problems/first-unique-character-in-a-string,"Hash Table, String, Queue, Counting"
MEDIUM,Count Good Numbers,39.0,0.00577880720267876,https://leetcode.com/problems/count-good-numbers,"Math, Recursion"
MEDIUM,Hand of Straights,39.0,0.005812370046783159,https://leetcode.com/problems/hand-of-straights,"Array, Hash Table, Greedy, Sorting"
MEDIUM,Non-overlapping Intervals,39.0,0.005728405445177871,https://leetcode.com/problems/non-overlapping-intervals,"Array, Dynamic Programming, Greedy, Sorting"
MEDIUM,Palindrome Partitioning,39.0,0.007421394986314191,https://leetcode.com/problems/palindrome-partitioning,"String, Dynamic Programming, Backtracking"
MEDIUM,Maximal Score After Applying K Operations,39.0,0.006411323703491657,https://leetcode.com/problems/maximal-score-after-applying-k-operations,"Array, Greedy, Heap (Priority Queue)"
EASY,Flood Fill,39.0,0.006845647847798841,https://leetcode.com/problems/flood-fill,"Array, Depth-First Search, Breadth-First Search, Matrix"
MEDIUM,Meeting Rooms II,39.0,0.005272302165786939,https://leetcode.com/problems/meeting-rooms-ii,"Array, Two Pointers, Greedy, Sorting, Heap (Priority Queue), Prefix Sum"
MEDIUM,Word Break,39.0,0.004958112753484877,https://leetcode.com/problems/word-break,"Array, Hash Table, String, Dynamic Programming, Trie, Memoization"
HARD,Word Break II,39.0,0.005572770278128279,https://leetcode.com/problems/word-break-ii,"Array, Hash Table, String, Dynamic Programming, Backtracking, Trie, Memoization"
MEDIUM,Maximum Palindromes After Operations,39.0,0.004701909498372936,https://leetcode.com/problems/maximum-palindromes-after-operations,"Array, Hash Table, String, Greedy, Sorting, Counting"
MEDIUM,Jump Game VI,39.0,0.004648507538622943,https://leetcode.com/problems/jump-game-vi,"Array, Dynamic Programming, Queue, Heap (Priority Queue), Monotonic Queue"
MEDIUM,Path With Minimum Effort,39.0,0.006346682870825001,https://leetcode.com/problems/path-with-minimum-effort,"Array, Binary Search, Depth-First Search, Breadth-First Search, Union-Find, Heap (Priority Queue), Matrix"
MEDIUM,Capacity To Ship Packages Within D Days,39.0,0.007414296936084103,https://leetcode.com/problems/capacity-to-ship-packages-within-d-days,"Array, Binary Search"
MEDIUM,Minimum Suffix Flips,39.0,0.0073972424133772275,https://leetcode.com/problems/minimum-suffix-flips,"String, Greedy"
MEDIUM,Longest Common Subsequence,39.0,0.00592844836648456,https://leetcode.com/problems/longest-common-subsequence,"String, Dynamic Programming"
MEDIUM,Minimize Maximum of Array,39.0,0.004654633935429862,https://leetcode.com/problems/minimize-maximum-of-array,"Array, Binary Search, Dynamic Programming, Greedy, Prefix Sum"
MEDIUM,Binary Tree Level Order Traversal,39.0,0.007290312109207177,https://leetcode.com/problems/binary-tree-level-order-traversal,"Tree, Breadth-First Search, Binary Tree"
HARD,Word Search II,39.0,0.0038586351195873435,https://leetcode.com/problems/word-search-ii,"Array, String, Backtracking, Trie, Matrix"
MEDIUM,Kth Largest Sum in a Binary Tree,39.0,0.005898157323706256,https://leetcode.com/problems/kth-largest-sum-in-a-binary-tree,"Tree, Breadth-First Search, Sorting, Binary Tree"
MEDIUM,Longest Non-decreasing Subarray From Two Arrays,39.0,0.0031269757418727305,https://leetcode.com/problems/longest-non-decreasing-subarray-from-two-arrays,"Array, Dynamic Programming"
MEDIUM,Search in Rotated Sorted Array,39.0,0.004509755149600735,https://leetcode.com/problems/search-in-rotated-sorted-array,"Array, Binary Search"
MEDIUM,Count Ways To Build Good Strings,39.0,0.005886860949101613,https://leetcode.com/problems/count-ways-to-build-good-strings,Dynamic Programming
