Difficulty,Title,Frequency,Acceptance Rate,Link,Topics
HARD,Count Paths That Can Form a Palindrome in a Tree,100.0,0.005257197762602519,https://leetcode.com/problems/count-paths-that-can-form-a-palindrome-in-a-tree,"Hash Table, Bit Manipulation, Tree, Depth-First Search"
HARD,Minimum Window Substring,86.9,0.004780071518455566,https://leetcode.com/problems/minimum-window-substring,"Hash Table, String, Sliding Window"
MEDIUM,Interleaving String,76.5,0.0044209044209044205,https://leetcode.com/problems/interleaving-string,"String, Dynamic Programming"
MEDIUM,Count Pairs of Connectable Servers in a Weighted Tree Network,76.5,0.005607322231033571,https://leetcode.com/problems/count-pairs-of-connectable-servers-in-a-weighted-tree-network,"Array, Tree, Depth-First Search"
HARD,Largest Rectangle in Histogram,76.5,0.005018806903086564,https://leetcode.com/problems/largest-rectangle-in-histogram,"Array, Stack, Monotonic Stack"
