Difficulty,Title,Frequency,Acceptance Rate,Link,Topics
MEDIUM,Maximal Square,100.0,0.005047494597175454,https://leetcode.com/problems/maximal-square,"Array, Dynamic Programming, Matrix"
MEDIUM,Design Tic-Tac-Toe,85.5,0.005874844437222803,https://leetcode.com/problems/design-tic-tac-toe,"Array, Hash Table, Design, Matrix, Simulation"
MEDIUM,Number of Perfect Pairs,80.8,0.003430410056869201,https://leetcode.com/problems/number-of-perfect-pairs,"Array, Math, Two Pointers, Sorting"
MEDIUM,Subarray Product Less Than K,66.3,0.005449010275694816,https://leetcode.com/problems/subarray-product-less-than-k,"Array, Binary Search, Sliding Window, Prefix Sum"
EASY,Odd String Difference,66.3,0.00620833390277569,https://leetcode.com/problems/odd-string-difference,"Array, Hash Table, String"
