Difficulty,Title,Frequency,Acceptance Rate,Link,Topics
EASY,Minimum Bit Flips to Convert Number,100.0,0.008792607988433038,https://leetcode.com/problems/minimum-bit-flips-to-convert-number,Bit Manipulation
EASY,Longest Common Prefix,80.2,0.004778177523381,https://leetcode.com/problems/longest-common-prefix,"Array, String, Trie"
EASY,Valid Parentheses,74.0,0.004436561966716398,https://leetcode.com/problems/valid-parentheses,"String, Stack"
MEDIUM,Group Anagrams,74.0,0.007279902010228705,https://leetcode.com/problems/group-anagrams,"Array, Hash Table, String, Sorting"
EASY,Two Sum,74.0,0.0057688973334014786,https://leetcode.com/problems/two-sum,"Array, Hash Table"
MEDIUM,Maximum Subarray,65.2,0.005347379998763699,https://leetcode.com/problems/maximum-subarray,"Array, Divide and Conquer, Dynamic Programming"
MEDIUM,Longest Substring Without Repeating Characters,65.2,0.003929968979427992,https://leetcode.com/problems/longest-substring-without-repeating-characters,"Hash Table, String, Sliding Window"
MEDIUM,Longest Palindromic Substring,65.2,0.003804657301544889,https://leetcode.com/problems/longest-palindromic-substring,"Two Pointers, String, Dynamic Programming"
EASY,Merge Sorted Array,65.2,0.0055096335369869,https://leetcode.com/problems/merge-sorted-array,"Array, Two Pointers, Sorting"
