Difficulty,Title,Frequency,Acceptance Rate,Link,Topics
MEDIUM,Longest Substring Without Repeating Characters,100.0,0.00392993807528904,https://leetcode.com/problems/longest-substring-without-repeating-characters,"Hash Table, String, Sliding Window"
EASY,Best Time to Buy and Sell Stock,100.0,0.005696313413604255,https://leetcode.com/problems/best-time-to-buy-and-sell-stock,"Array, Dynamic Programming"
MEDIUM,XOR Queries of a Subarray,88.4,0.007802875252292766,https://leetcode.com/problems/xor-queries-of-a-subarray,"Array, Bit Manipulation, Prefix Sum"
MEDIUM,Find Polygon With the Largest Perimeter,88.4,0.006555383693795988,https://leetcode.com/problems/find-polygon-with-the-largest-perimeter,"Array, Greedy, Sorting, Prefix Sum"
MEDIUM,Find First and Last Position of Element in Sorted Array,88.4,0.00491214767986976,https://leetcode.com/problems/find-first-and-last-position-of-element-in-sorted-array,"Array, Binary Search"
MEDIUM,Next Permutation,88.4,0.004551813068260061,https://leetcode.com/problems/next-permutation,"Array, Two Pointers"
MEDIUM,Container With Most Water,88.4,0.006024272936922577,https://leetcode.com/problems/container-with-most-water,"Array, Two Pointers, Greedy"
