Difficulty,Title,Frequency,Acceptance Rate,Link,Topics
EASY,Merge Sorted Array,100.0,0.005509630082139076,https://leetcode.com/problems/merge-sorted-array,"Array, Two Pointers, Sorting"
MEDIUM,LRU Cache,85.4,0.004754641880119744,https://leetcode.com/problems/lru-cache,"Hash Table, Linked List, Design, Doubly-Linked List"
EASY,Check if All the Integers in a Range Are Covered,83.5,0.0051171624847179365,https://leetcode.com/problems/check-if-all-the-integers-in-a-range-are-covered,"Array, Hash Table, Prefix Sum"
EASY,Merge Two Sorted Lists,63.1,0.006845218003844969,https://leetcode.com/problems/merge-two-sorted-lists,"Linked List, Recursion"
MEDIUM,Merge Intervals,55.6,0.005211662708590609,https://leetcode.com/problems/merge-intervals,"Array, Sorting"
