Difficulty,Title,Frequency,Acceptance Rate,Link,Topics
MEDIUM,Number of Accounts That Did Not Stream,100.0,0.007197607218898915,https://leetcode.com/problems/number-of-accounts-that-did-not-stream,Database
HARD,Merge k Sorted Lists,80.1,0.005981782744989541,https://leetcode.com/problems/merge-k-sorted-lists,"Linked List, Divide and Conquer, Heap (Priority Queue), Merge Sort"
HARD,Integer to English Words,73.8,0.003506798222457669,https://leetcode.com/problems/integer-to-english-words,"Math, String, Recursion"
MEDIUM,Product of Array Except Self,73.8,0.0069001713735827195,https://leetcode.com/problems/product-of-array-except-self,"Array, Prefix Sum"
EASY,Roman to Integer,73.8,0.006679181541024276,https://leetcode.com/problems/roman-to-integer,"Hash Table, Math, String"
MEDIUM,Game of Life,65.0,0.007272397684186423,https://leetcode.com/problems/game-of-life,"Array, Matrix, Simulation"
MEDIUM,Flatten Nested List Iterator,65.0,0.0065744363274518845,https://leetcode.com/problems/flatten-nested-list-iterator,"Stack, Tree, Depth-First Search, Design, Queue, Iterator"
MEDIUM,3Sum,65.0,0.003930121308153282,https://leetcode.com/problems/3sum,"Array, Two Pointers, Sorting"
EASY,Two Sum,65.0,0.005768896943827939,https://leetcode.com/problems/two-sum,"Array, Hash Table"
