Difficulty,Title,Frequency,Acceptance Rate,Link,Topics
MEDIUM,Largest Number,100.0,0.004323284774291645,https://leetcode.com/problems/largest-number,"Array, String, Greedy, Sorting"
EASY,Move Zeroes,83.4,0.006398874920858486,https://leetcode.com/problems/move-zeroes,"Array, Two Pointers"
MEDIUM,Maximum Twin Sum of a Linked List,83.4,0.008324292901958425,https://leetcode.com/problems/maximum-twin-sum-of-a-linked-list,"Linked List, Two Pointers, Stack"
MEDIUM,Reverse Nodes in Even Length Groups,83.4,0.006447893510458794,https://leetcode.com/problems/reverse-nodes-in-even-length-groups,Linked List
MEDIUM,Spiral Matrix,79.0,0.005707391086003881,https://leetcode.com/problems/spiral-matrix,"Array, Matrix, Simulation"
MEDIUM,Reverse Odd Levels of Binary Tree,73.7,0.008666865844604995,https://leetcode.com/problems/reverse-odd-levels-of-binary-tree,"Tree, Depth-First Search, Breadth-First Search, Binary Tree"
MEDIUM,Delete Leaves With a Given Value,73.7,0.007723335346430304,https://leetcode.com/problems/delete-leaves-with-a-given-value,"Tree, Depth-First Search, Binary Tree"
MEDIUM,Merge Nodes in Between Zeros,66.8,0.008967193973441765,https://leetcode.com/problems/merge-nodes-in-between-zeros,"Linked List, Simulation"
MEDIUM,Minimum Swaps to Group All 1's Together II,66.8,0.006568167267272762,https://leetcode.com/problems/minimum-swaps-to-group-all-1s-together-ii,"Array, Sliding Window"
EASY,Count Pairs Whose Sum is Less than Target,66.8,0.008777554599075402,https://leetcode.com/problems/count-pairs-whose-sum-is-less-than-target,"Array, Two Pointers, Binary Search, Sorting"
MEDIUM,Find Bottom Left Tree Value,66.8,0.00723891514471214,https://leetcode.com/problems/find-bottom-left-tree-value,"Tree, Depth-First Search, Breadth-First Search, Binary Tree"
MEDIUM,Koko Eating Bananas,66.8,0.005015283612699998,https://leetcode.com/problems/koko-eating-bananas,"Array, Binary Search"
MEDIUM,Remove K Digits,66.8,0.0037086822851786715,https://leetcode.com/problems/remove-k-digits,"String, Stack, Greedy, Monotonic Stack"
EASY,Invert Binary Tree,66.8,0.00801734103148543,https://leetcode.com/problems/invert-binary-tree,"Tree, Depth-First Search, Breadth-First Search, Binary Tree"
MEDIUM,Daily Temperatures,66.8,0.006882789634821882,https://leetcode.com/problems/daily-temperatures,"Array, Stack, Monotonic Stack"
MEDIUM,Maximum Difference Between Node and Ancestor,66.8,0.007817831307826654,https://leetcode.com/problems/maximum-difference-between-node-and-ancestor,"Tree, Depth-First Search, Binary Tree"
MEDIUM,Group Anagrams,66.8,0.007279902010228705,https://leetcode.com/problems/group-anagrams,"Array, Hash Table, String, Sorting"
EASY,Merge Two Sorted Lists,66.8,0.00684521438226733,https://leetcode.com/problems/merge-two-sorted-lists,"Linked List, Recursion"
MEDIUM,Sum of Nodes with Even-Valued Grandparent,66.8,0.008595838703737802,https://leetcode.com/problems/sum-of-nodes-with-even-valued-grandparent,"Tree, Depth-First Search, Breadth-First Search, Binary Tree"
MEDIUM,Odd Even Linked List,66.8,0.006259837445036772,https://leetcode.com/problems/odd-even-linked-list,Linked List
MEDIUM,Rotate List,66.8,0.004277474736266281,https://leetcode.com/problems/rotate-list,"Linked List, Two Pointers"
MEDIUM,Find the Substring With Maximum Cost,57.2,0.005819446890963536,https://leetcode.com/problems/find-the-substring-with-maximum-cost,"Array, Hash Table, String, Dynamic Programming"
HARD,Reverse Nodes in k-Group,57.2,0.006642205309841066,https://leetcode.com/problems/reverse-nodes-in-k-group,"Linked List, Recursion"
MEDIUM,Count Good Nodes in Binary Tree,57.2,0.00738929102985241,https://leetcode.com/problems/count-good-nodes-in-binary-tree,"Tree, Depth-First Search, Breadth-First Search, Binary Tree"
HARD,Largest Rectangle in Histogram,57.2,0.005018800727170159,https://leetcode.com/problems/largest-rectangle-in-histogram,"Array, Stack, Monotonic Stack"
MEDIUM,Flatten Binary Tree to Linked List,57.2,0.007095766940286496,https://leetcode.com/problems/flatten-binary-tree-to-linked-list,"Linked List, Stack, Tree, Depth-First Search, Binary Tree"
MEDIUM,Remove Nth Node From End of List,57.2,0.0051885903551502684,https://leetcode.com/problems/remove-nth-node-from-end-of-list,"Linked List, Two Pointers"
HARD,Palindrome Partitioning II,57.2,0.003729334932270199,https://leetcode.com/problems/palindrome-partitioning-ii,"String, Dynamic Programming"
EASY,Merge Two Binary Trees,57.2,0.007909669538662886,https://leetcode.com/problems/merge-two-binary-trees,"Tree, Depth-First Search, Breadth-First Search, Binary Tree"
MEDIUM,Search in Rotated Sorted Array,57.2,0.004509757593977522,https://leetcode.com/problems/search-in-rotated-sorted-array,"Array, Binary Search"
MEDIUM,Find Largest Value in Each Tree Row,57.2,0.0066336729547566906,https://leetcode.com/problems/find-largest-value-in-each-tree-row,"Tree, Depth-First Search, Breadth-First Search, Binary Tree"
EASY,Island Perimeter,57.2,0.007453714603332513,https://leetcode.com/problems/island-perimeter,"Array, Depth-First Search, Breadth-First Search, Matrix"
EASY,Climbing Stairs,57.2,0.005415763415098653,https://leetcode.com/problems/climbing-stairs,"Math, Dynamic Programming, Memoization"
